{
  "calls": null,
  "files": [
    {
      "base_path": "src/lib.rs",
      "branches": [],
      "count_changed": [],
      "flaky": [],
      "functions": [
        {
          "end": 7,
          "lines": {
            "executable": 3,
            "gained": 0,
            "lost": 0
          },
          "name": "divide",
          "start": 1,
          "status": "unchanged"
        },
        {
          "end": 14,
          "lines": {
            "executable": 5,
            "gained": 0,
            "lost": 1
          },
          "name": "classify",
          "start": 8,
          "status": "partial_loss"
        }
      ],
      "inferred_side": null,
      "lines": [
        {
          "base_line": 1,
          "category": "kept_hit",
          "hits": [
            3,
            3
          ],
          "line": 1
        },
        {
          "base_line": 2,
          "category": "kept_hit",
          "hits": [
            1,
            1
          ],
          "line": 2
        },
        {
          "base_line": 3,
          "category": "kept_hit",
          "hits": [
            1,
            1
          ],
          "line": 3
        },
        {
          "base_line": 5,
          "category": "kept_hit",
          "hits": [
            2,
            2
          ],
          "line": 5
        },
        {
          "base_line": 8,
          "category": "kept_hit",
          "hits": [
            1,
            1
          ],
          "line": 8
        },
        {
          "base_line": 9,
          "category": "kept_hit",
          "hits": [
            2,
            1
          ],
          "line": 9
        },
        {
          "base_line": 10,
          "category": "lost",
          "hits": [
            1,
            0
          ],
          "line": 10
        },
        {
          "base_line": 11,
          "category": "kept_hit",
          "hits": [
            2,
            2
          ],
          "line": 11
        },
        {
          "base_line": 12,
          "category": "kept_hit",
          "hits": [
            1,
            1
          ],
          "line": 12
        },
        {
          "base_line": 14,
          "category": "kept_hit",
          "hits": [
            1,
            1
          ],
          "line": 14
        }
      ],
      "path": "src/lib.rs",
      "sha256": {
        "base": "8ec66d218facd34ba7e1d2c167be8174ce68624ea87e524c59d6c30f9dab1a5e",
        "patched": "915049711dc52af164094060b8cc885591d27a0cf9ed0b5ea6bb3670be392ffe"
      },
      "source_changed": true
    }
  ],
  "meta": {
    "base_ref": "a12df520182e08035a46b4eca2fe0f40d66333a6",
    "commands": [
      "cargo tarpaulin --out Lcov --output-dir {out} --"
    ],
    "created_utc": "2026-01-01T00:00:00Z",
    "inputs": {
      "base_lcov_sha256": [
        "0000000000000000000000000000000000000000000000000000000000000000"
      ],
      "patched_lcov_sha256": [
        "0000000000000000000000000000000000000000000000000000000000000000"
      ]
    },
    "mode": "run",
    "patch": {
      "files": [
        "src/lib.rs"
      ],
      "path": "drop_neg_sample.patch",
      "sha256": "8d5fe075f20fc2538895cbfda14a0eb1dfdce95fedfef5e989d6e7e01fbc9ed5"
    },
    "preset": "cargo-tarpaulin",
    "repeat": 1,
    "selection": {
      "reason": "no selector; running all tests",
      "run_all": true,
      "tests": []
    },
    "sundgren_version": "<version>"
  },
  "schema": "sundgren.delta/1",
  "summary": {
    "branches": {
      "deleted": 0,
      "gained": 0,
      "lost": 0,
      "new": 0
    },
    "coverage": {
      "base_pct": 100.0,
      "patched_pct": 90.0
    },
    "external_files": 0,
    "functions": {
      "added": 0,
      "lit_up": 0,
      "mixed": 0,
      "partial_gain": 0,
      "partial_loss": 1,
      "removed": 0,
      "went_dark": 0
    },
    "lines": {
      "deleted_hit": 0,
      "deleted_miss": 0,
      "flaky": 0,
      "gained": 0,
      "lost": 1,
      "new_hit": 0,
      "new_miss": 0,
      "unmeasured": 0
    }
  },
  "tests": [],
  "tree": {
    "children": [
      {
        "children": [
          {
            "kind": "file",
            "name": "lib.rs",
            "path": "src/lib.rs",
            "stats": {
              "deleted_hit": 0,
              "deleted_miss": 0,
              "executable_base": 10,
              "executable_patched": 10,
              "gained": 0,
              "hit_base": 10,
              "hit_patched": 9,
              "lost": 1,
              "new_hit": 0,
              "new_miss": 0
            }
          }
        ],
        "kind": "dir",
        "name": "src",
        "path": "src",
        "stats": {
          "deleted_hit": 0,
          "deleted_miss": 0,
          "executable_base": 10,
          "executable_patched": 10,
          "gained": 0,
          "hit_base": 10,
          "hit_patched": 9,
          "lost": 1,
          "new_hit": 0,
          "new_miss": 0
        }
      }
    ],
    "kind": "dir",
    "name": "",
    "path": "",
    "stats": {
      "deleted_hit": 0,
      "deleted_miss": 0,
      "executable_base": 10,
      "executable_patched": 10,
      "gained": 0,
      "hit_base": 10,
      "hit_patched": 9,
      "lost": 1,
      "new_hit": 0,
      "new_miss": 0
    }
  },
  "warnings": []
}
