{
  "calls": null,
  "files": [
    {
      "base_path": "src/lib.rs",
      "branches": [],
      "count_changed": [],
      "flaky": [],
      "functions": [
        {
          "end": 7,
          "lines": {
            "executable": 3,
            "gained": 0,
            "lost": 0
          },
          "name": "divide",
          "start": 1,
          "status": "unchanged"
        },
        {
          "end": 16,
          "lines": {
            "executable": 7,
            "gained": 0,
            "lost": 0
          },
          "name": "classify",
          "start": 8,
          "status": "unchanged"
        }
      ],
      "inferred_side": null,
      "lines": [
        {
          "base_line": 1,
          "category": "kept_hit",
          "hits": [
            2,
            2
          ],
          "line": 1
        },
        {
          "base_line": 2,
          "category": "kept_miss",
          "hits": [
            0,
            0
          ],
          "line": 2
        },
        {
          "base_line": 3,
          "category": "kept_miss",
          "hits": [
            0,
            0
          ],
          "line": 3
        },
        {
          "base_line": 5,
          "category": "kept_miss",
          "hits": [
            0,
            0
          ],
          "line": 5
        },
        {
          "base_line": 8,
          "category": "kept_hit",
          "hits": [
            1,
            1
          ],
          "line": 8
        },
        {
          "base_line": 9,
          "category": "kept_hit",
          "hits": [
            2,
            2
          ],
          "line": 9
        },
        {
          "base_line": 10,
          "category": "kept_hit",
          "hits": [
            1,
            1
          ],
          "line": 10
        },
        {
          "base_line": 11,
          "category": "kept_hit",
          "hits": [
            2,
            2
          ],
          "line": 11
        },
        {
          "base_line": 12,
          "category": "kept_hit",
          "hits": [
            1,
            1
          ],
          "line": 12
        },
        {
          "base_line": null,
          "category": "new_hit",
          "hits": [
            null,
            2
          ],
          "line": 13
        },
        {
          "base_line": null,
          "category": "new_miss",
          "hits": [
            null,
            0
          ],
          "line": 14
        },
        {
          "base_line": 14,
          "category": "kept_hit",
          "hits": [
            1,
            1
          ],
          "line": 16
        }
      ],
      "path": "src/lib.rs",
      "sha256": {
        "base": "d1a00058c708b6aa13abc255655ea1dc4073ebdbd120b288cb79f955168bf4b1",
        "patched": "4f97cdfa568119c7fa5721e7c0b7c3cb2ce2dc39a4e9281fc1e73456ee4301b1"
      },
      "source_changed": true
    }
  ],
  "meta": {
    "base_ref": "d762e7b462b7a5167b0a970579a99b81db18a2fa",
    "commands": [
      "cargo tarpaulin --out Lcov --output-dir {out} -- test_classify"
    ],
    "created_utc": "2026-01-01T00:00:00Z",
    "inputs": {
      "base_lcov_sha256": [
        "0000000000000000000000000000000000000000000000000000000000000000"
      ],
      "patched_lcov_sha256": [
        "0000000000000000000000000000000000000000000000000000000000000000"
      ]
    },
    "mode": "run",
    "patch": {
      "files": [
        "src/lib.rs"
      ],
      "path": "add_big.patch",
      "sha256": "3a7bcec055cc129539c9a9431c3379f6515cda5d615b6fbfd8f85c2df4642102"
    },
    "preset": "cargo-tarpaulin",
    "repeat": 1,
    "selection": {
      "reason": "--tests given",
      "run_all": false,
      "tests": [
        "test_classify"
      ]
    },
    "sundgren_version": "<version>"
  },
  "schema": "sundgren.delta/1",
  "summary": {
    "branches": {
      "deleted": 0,
      "gained": 0,
      "lost": 0,
      "new": 0
    },
    "coverage": {
      "base_pct": 70.0,
      "patched_pct": 66.7
    },
    "external_files": 0,
    "functions": {
      "added": 0,
      "lit_up": 0,
      "mixed": 0,
      "partial_gain": 0,
      "partial_loss": 0,
      "removed": 0,
      "went_dark": 0
    },
    "lines": {
      "deleted_hit": 0,
      "deleted_miss": 0,
      "flaky": 0,
      "gained": 0,
      "lost": 0,
      "new_hit": 1,
      "new_miss": 1,
      "unmeasured": 0
    }
  },
  "tests": [],
  "tree": {
    "children": [
      {
        "children": [
          {
            "kind": "file",
            "name": "lib.rs",
            "path": "src/lib.rs",
            "stats": {
              "deleted_hit": 0,
              "deleted_miss": 0,
              "executable_base": 10,
              "executable_patched": 12,
              "gained": 0,
              "hit_base": 7,
              "hit_patched": 8,
              "lost": 0,
              "new_hit": 1,
              "new_miss": 1
            }
          }
        ],
        "kind": "dir",
        "name": "src",
        "path": "src",
        "stats": {
          "deleted_hit": 0,
          "deleted_miss": 0,
          "executable_base": 10,
          "executable_patched": 12,
          "gained": 0,
          "hit_base": 7,
          "hit_patched": 8,
          "lost": 0,
          "new_hit": 1,
          "new_miss": 1
        }
      }
    ],
    "kind": "dir",
    "name": "",
    "path": "",
    "stats": {
      "deleted_hit": 0,
      "deleted_miss": 0,
      "executable_base": 10,
      "executable_patched": 12,
      "gained": 0,
      "hit_base": 7,
      "hit_patched": 8,
      "lost": 0,
      "new_hit": 1,
      "new_miss": 1
    }
  },
  "warnings": []
}
